{
  "id": "kmou-2026-computer-engineering-curriculum-candidate",
  "version": "0.1.0",
  "status": "review",
  "selector": {
    "universityId": "kmou",
    "admissionYear": 2026,
    "departmentId": "computer-engineering"
  },
  "effectiveFrom": "2026-03-01",
  "requiredTotalCredits": 135,
  "creditRequirements": [
    {
      "key": "generalRequired",
      "label": "교양필수",
      "shortLabel": "교필",
      "minimum": 26,
      "color": "var(--blue)"
    },
    {
      "key": "generalElective",
      "label": "교양선택",
      "shortLabel": "교선",
      "minimum": 15,
      "color": "var(--violet)"
    },
    {
      "key": "majorFoundation",
      "label": "전공기초",
      "shortLabel": "전기",
      "minimum": 12,
      "color": "var(--cyan)"
    },
    {
      "key": "majorRequired",
      "label": "전공필수",
      "shortLabel": "전필",
      "minimum": 43,
      "color": "var(--green)"
    },
    {
      "key": "majorElective",
      "label": "전공선택",
      "shortLabel": "전선",
      "minimum": 15,
      "color": "var(--amber)"
    },
    {
      "key": "freeElective",
      "label": "일반선택",
      "shortLabel": "일선",
      "minimum": 24,
      "color": "var(--slate)"
    }
  ],
  "requiredCourses": [],
  "substitutions": [],
  "categoryOverrides": [],
  "certifications": [],
  "eligibilityRules": [
    {
      "goal": "regular",
      "eligibleStudentTypes": [
        "freshman",
        "transfer"
      ]
    }
  ],
  "sources": [
    {
      "id": "kmou-2026-new-student-course-guide",
      "title": "2026학년도 신입생 수강안내 편제학점표",
      "organization": "국립한국해양대학교",
      "updatedAt": "2026학년도",
      "url": "https://www.kmou.ac.kr/common/nttFileDownload.do?fileKey=98f1de7f163ea8019c28b462168c997d",
      "fileName": "2026_official_curriculum.pdf",
      "fileHash": "sha256:199de99df355d940b3f80d8e04e75389ad39c5d7afa5ac82bfe3cbbbc326ef91",
      "documentVersionId": "kmou-2026-new-student-course-guide@199de99df355"
    }
  ],
  "notes": [
    "이 규칙은 해당 적용 교육과정의 공통 졸업요건이며 신입생과 편입생에게 동일하게 적용합니다.",
    "공식 편제학점표의 '인공지능공학부 컴퓨터공학전공' 행에서 영역별 학점과 총 졸업학점만 검증한 후보입니다.",
    "관리자 승인 전이며 운영 판정에 사용할 수 없습니다.",
    "과목별 필수·대체과목·폐지과목·경과조치·개인별 적용 교육과정년도는 추가 검증이 필요합니다."
  ],
  "generalEducationAreas": [],
  "generalEducationCombinedRequirements": []
}
