{
  "id": "kmou-2022-computer-engineering-curriculum-candidate",
  "version": "0.1.0",
  "status": "review",
  "selector": {
    "universityId": "kmou",
    "admissionYear": 2022,
    "departmentId": "computer-engineering"
  },
  "effectiveFrom": "2022-03-01",
  "requiredTotalCredits": 140,
  "creditRequirements": [
    {
      "key": "generalRequired",
      "label": "교양필수",
      "shortLabel": "교필",
      "minimum": 26,
      "color": "var(--blue)"
    },
    {
      "key": "generalElective",
      "label": "교양선택",
      "shortLabel": "교선",
      "minimum": 17,
      "color": "var(--violet)"
    },
    {
      "key": "majorFoundation",
      "label": "전공기초",
      "shortLabel": "전기",
      "minimum": 15,
      "color": "var(--cyan)"
    },
    {
      "key": "majorRequired",
      "label": "전공필수",
      "shortLabel": "전필",
      "minimum": 60,
      "color": "var(--green)"
    },
    {
      "key": "majorElective",
      "label": "전공선택",
      "shortLabel": "전선",
      "minimum": 12,
      "color": "var(--amber)"
    },
    {
      "key": "freeElective",
      "label": "일반선택",
      "shortLabel": "일선",
      "minimum": 10,
      "color": "var(--slate)"
    }
  ],
  "requiredCourses": [
    {
      "code": "09230",
      "name": "KMOU미래설계및상담Ⅰ",
      "credits": 0,
      "category": "generalRequired",
      "priority": "필수"
    },
    {
      "code": "09231",
      "name": "KMOU미래설계및상담Ⅱ",
      "credits": 0,
      "category": "generalRequired",
      "priority": "필수"
    },
    {
      "code": "L0002",
      "name": "대학생을위한글쓰기",
      "credits": 2,
      "category": "generalRequired",
      "priority": "필수"
    },
    {
      "code": "L0004",
      "name": "KMOU EnglishⅠ",
      "credits": 2,
      "category": "generalRequired",
      "priority": "필수"
    },
    {
      "code": "L1313",
      "name": "컴퓨터프로그래밍및실습",
      "credits": 3,
      "category": "generalRequired",
      "priority": "필수"
    },
    {
      "code": "L1511",
      "name": "공업수학",
      "credits": 3,
      "category": "generalRequired",
      "priority": "필수"
    },
    {
      "code": "L1505",
      "name": "미적분학",
      "credits": 3,
      "category": "generalRequired",
      "priority": "필수"
    },
    {
      "code": "L1513",
      "name": "기초확률및통계",
      "credits": 2,
      "category": "generalRequired",
      "priority": "필수"
    },
    {
      "code": "L1512",
      "name": "선형대수학",
      "credits": 3,
      "category": "generalRequired",
      "priority": "필수"
    },
    {
      "code": "L3413",
      "name": "RC Idea Factory",
      "credits": 1,
      "category": "generalRequired",
      "priority": "필수"
    },
    {
      "code": "L1701",
      "name": "물리의이해",
      "credits": 2,
      "category": "generalRequired",
      "priority": "필수"
    },
    {
      "code": "L4109",
      "name": "앵커스피릿",
      "credits": 2,
      "category": "generalRequired",
      "priority": "필수"
    },
    {
      "code": "L1705",
      "name": "실험을통한물리의활용",
      "credits": 1,
      "category": "generalRequired",
      "priority": "필수"
    },
    {
      "code": "53581",
      "name": "컴퓨터언어및실습 II",
      "credits": 3,
      "category": "majorFoundation",
      "priority": "필수"
    },
    {
      "code": "L2028",
      "name": "Let's Be 해대인",
      "credits": 2,
      "category": "generalRequired",
      "priority": "필수"
    },
    {
      "code": "90536",
      "name": "기초물리학",
      "credits": 2,
      "category": "majorFoundation",
      "priority": "필수"
    },
    {
      "code": "90537",
      "name": "기초물리학실험",
      "credits": 1,
      "category": "majorFoundation",
      "priority": "필수"
    },
    {
      "code": "53371",
      "name": "공학개론",
      "credits": 3,
      "category": "majorRequired",
      "priority": "필수"
    },
    {
      "code": "51480",
      "name": "회로이론",
      "credits": 3,
      "category": "majorRequired",
      "priority": "필수"
    },
    {
      "code": "09232",
      "name": "KMOU미래설계및상담Ⅲ",
      "credits": 0,
      "category": "generalRequired",
      "priority": "필수"
    },
    {
      "code": "09233",
      "name": "KMOU미래설계및상담Ⅳ",
      "credits": 0,
      "category": "generalRequired",
      "priority": "필수"
    },
    {
      "code": "53531",
      "name": "전자회로및실험I",
      "credits": 3,
      "category": "majorFoundation",
      "priority": "필수"
    },
    {
      "code": "53532",
      "name": "전자회로및실험Ⅱ",
      "credits": 3,
      "category": "majorFoundation",
      "priority": "필수"
    },
    {
      "code": "51181",
      "name": "자동제어 I",
      "credits": 3,
      "category": "majorRequired",
      "priority": "필수"
    },
    {
      "code": "53535",
      "name": "컴퓨터언어및실습Ⅲ",
      "credits": 3,
      "category": "majorFoundation",
      "priority": "필수"
    },
    {
      "code": "52127",
      "name": "디지털회로및실습",
      "credits": 3,
      "category": "majorRequired",
      "priority": "필수"
    },
    {
      "code": "51411",
      "name": "컴퓨터구조론",
      "credits": 3,
      "category": "majorRequired",
      "priority": "필수"
    },
    {
      "code": "54936",
      "name": "인공지능코딩기초및실습",
      "credits": 3,
      "category": "majorRequired",
      "priority": "필수"
    },
    {
      "code": "54621",
      "name": "Adventure Design",
      "credits": 2,
      "category": "majorRequired",
      "priority": "필수"
    },
    {
      "code": "54937",
      "name": "자료구조및실습",
      "credits": 3,
      "category": "majorRequired",
      "priority": "필수"
    },
    {
      "code": "54943",
      "name": "시퀀스제어및PLC프로그래밍",
      "credits": 3,
      "category": "majorRequired",
      "priority": "필수"
    },
    {
      "code": "51000",
      "name": "계측공학",
      "credits": 3,
      "category": "majorRequired",
      "priority": "필수"
    },
    {
      "code": "51464",
      "name": "현대제어",
      "credits": 3,
      "category": "majorRequired",
      "priority": "필수"
    },
    {
      "code": "51189",
      "name": "자동제어실험",
      "credits": 2,
      "category": "majorRequired",
      "priority": "필수"
    },
    {
      "code": "51554",
      "name": "디지털신호처리",
      "credits": 3,
      "category": "majorRequired",
      "priority": "필수"
    },
    {
      "code": "51627",
      "name": "로봇공학",
      "credits": 3,
      "category": "majorRequired",
      "priority": "필수"
    },
    {
      "code": "51961",
      "name": "센서공학",
      "credits": 3,
      "category": "majorRequired",
      "priority": "필수"
    },
    {
      "code": "54938",
      "name": "임베디드코딩및실습",
      "credits": 3,
      "category": "majorRequired",
      "priority": "필수"
    },
    {
      "code": "53367",
      "name": "캡스톤디자인Ⅰ",
      "credits": 2,
      "category": "majorRequired",
      "priority": "필수"
    },
    {
      "code": "90583",
      "name": "지능제어및실습",
      "credits": 3,
      "category": "majorRequired",
      "priority": "필수"
    },
    {
      "code": "52264",
      "name": "계측공학실험",
      "credits": 2,
      "category": "majorRequired",
      "priority": "필수"
    },
    {
      "code": "53368",
      "name": "캡스톤디자인Ⅱ",
      "credits": 2,
      "category": "majorRequired",
      "priority": "필수"
    },
    {
      "code": "90584",
      "name": "영상처리및실습",
      "credits": 3,
      "category": "majorRequired",
      "priority": "필수"
    }
  ],
  "substitutions": [],
  "categoryOverrides": [],
  "certifications": [
    {
      "id": "language-one-of",
      "label": "공식 외국어 기준 중 1개 이상",
      "kind": "language",
      "acceptedValues": [
        "TOEIC 600점",
        "OPIc Novice High",
        "TOEIC Speaking Lv.4",
        "New TEPS 268점",
        "TOEFL CBT 177점",
        "TOEFL PBT 567점",
        "TOEFL iBT 63점",
        "JPT 500점",
        "JLPT 3급",
        "HSK 4급",
        "한자능력검정시험 2급 이상"
      ]
    },
    {
      "id": "activity-volunteer",
      "label": "사회봉사활동 30시간 이상",
      "kind": "volunteer",
      "minimum": 30,
      "unit": "시간",
      "oneOfGroup": "activity"
    },
    {
      "id": "activity-internship",
      "label": "전공선택 현장실습 Ⅰ·Ⅱ 또는 현장실습 중 1개 이상",
      "kind": "internship",
      "oneOfGroup": "activity"
    },
    {
      "id": "activity-certificate",
      "label": "산업기사 이상 국가기술자격 또는 인정 국제공인 자격 중 1개 이상",
      "kind": "certificate",
      "oneOfGroup": "activity"
    }
  ],
  "eligibilityRules": [
    {
      "goal": "regular",
      "eligibleStudentTypes": [
        "freshman",
        "transfer"
      ]
    }
  ],
  "sources": [
    {
      "id": "kmou-2022-new-student-course-guide",
      "title": "2022학년도 신입생 수강안내 편제학점표",
      "organization": "국립한국해양대학교",
      "updatedAt": "2022학년도",
      "url": "https://www.kmou.ac.kr/common/nttFileDownload.do?fileKey=ebc85967f5098b5feff20c2ecd4ed44b",
      "fileName": "2022_official_curriculum.pdf",
      "fileHash": "sha256:630fa6597fe252dc0055d660210894574cd31e481f4bfb46fc829d59c7f14675",
      "documentVersionId": "kmou-2022-new-student-course-guide@630fa6597fe2"
    },
    {
      "id": "kmou-2022-computer-engineering-detailed-curriculum",
      "title": "2022학년도 IT융합전공 상세 교육과정표",
      "organization": "국립한국해양대학교 인공지능공학부",
      "updatedAt": "2022학년도",
      "url": "https://www.kmou.ac.kr/common/nttFileDownload.do?fileKey=25327f0e142f0b096955f1a3d01e58ee",
      "fileName": "2022_computer_engineering_curriculum.xlsx",
      "fileHash": "sha256:f3a5f3fb947699d1062ae2b8d99d6ebb14b5b54d94f1acbbce5beff554d70501",
      "documentVersionId": "kmou-2022-computer-engineering-detailed-curriculum@f3a5f3fb9476"
    }
  ],
  "notes": [
    "이 규칙은 해당 적용 교육과정의 공통 졸업요건이며 신입생과 편입생에게 동일하게 적용합니다.",
    "공식 편제학점표의 '인공지능공학부 IT융합전공' 행에서 영역별 학점과 총 졸업학점만 검증한 후보입니다.",
    "관리자 승인 전이며 운영 판정에 사용할 수 없습니다.",
    "과목별 필수·대체과목·폐지과목·경과조치·개인별 적용 교육과정년도는 추가 검증이 필요합니다.",
    "2022년은 상세 Excel의 필수 교과목 후보까지 포함했으나 폐지·대체·개인별 예외 검토 전입니다."
  ],
  "generalEducationAreas": [],
  "generalEducationCombinedRequirements": []
}
